{
  "agreement_report_version": "0.1.0",
  "artifact_sha256": "bf33db23ab1dbe60fce35c3a7ccc9cd1a016aa5e0cd69b2ce8c9dd57d5257517",
  "claim_results": [
    {
      "claim_id": "audio.duration",
      "confidence": 1.0,
      "coverage_fraction": 1.0,
      "errors": {
        "absolute_error": 0.0
      },
      "evidence_ids": [
        "ave_8531165cfb44b734"
      ],
      "limitations": [],
      "observed": {
        "kind": "scalar",
        "value": 12.0
      },
      "reason": "Numeric tolerance passed.",
      "required": true,
      "state": "agree"
    },
    {
      "claim_id": "audio.sample_peak",
      "confidence": 1.0,
      "coverage_fraction": 1.0,
      "errors": {
        "absolute_error": 1.2207031e-05
      },
      "evidence_ids": [
        "ave_8531165cfb44b734"
      ],
      "limitations": [
        "Digital peak is not calibrated SPL."
      ],
      "observed": {
        "kind": "scalar",
        "value": 0.79998779296875
      },
      "reason": "Numeric tolerance passed.",
      "required": true,
      "state": "agree"
    },
    {
      "claim_id": "audio.left_carrier.frequency",
      "confidence": 1.0,
      "coverage_fraction": 1.0,
      "errors": {
        "absolute_error": 0.0
      },
      "evidence_ids": [
        "ave_0a3dd986efbc189b"
      ],
      "limitations": [],
      "observed": {
        "kind": "scalar",
        "value": 440.0
      },
      "reason": "Numeric tolerance passed.",
      "required": true,
      "state": "agree"
    },
    {
      "claim_id": "audio.right_carrier.frequency",
      "confidence": 1.0,
      "coverage_fraction": 1.0,
      "errors": {
        "absolute_error": 0.0
      },
      "evidence_ids": [
        "ave_2279486a1575ed42"
      ],
      "limitations": [],
      "observed": {
        "kind": "scalar",
        "value": 450.0
      },
      "reason": "Numeric tolerance passed.",
      "required": true,
      "state": "agree"
    },
    {
      "claim_id": "audio.interchannel_difference",
      "confidence": 1.0,
      "coverage_fraction": 1.0,
      "errors": {
        "absolute_error": 0.0
      },
      "evidence_ids": [
        "ave_9da5878f729d7bfb"
      ],
      "limitations": [],
      "observed": {
        "kind": "scalar",
        "value": 10.0
      },
      "reason": "Numeric tolerance passed.",
      "required": true,
      "state": "agree"
    },
    {
      "claim_id": "audio.channel_routing",
      "confidence": 1.0,
      "coverage_fraction": 1.0,
      "errors": {
        "exact_match": true
      },
      "evidence_ids": [
        "ave_9da5878f729d7bfb"
      ],
      "limitations": [],
      "observed": {
        "kind": "category",
        "value": "separate_left_right_carriers"
      },
      "reason": "Exact comparison passed.",
      "required": true,
      "state": "agree"
    }
  ],
  "declaration_contract": "ave-demo-declaration@0.1.0",
  "declaration_id": "ave-demo-001-binaural-construction@1.0.0",
  "declaration_schema_sha256": "aca39c90191762cde5048dfefc6f732d9e0c43e2da668194f2cc6cb04175ab45",
  "declaration_sha256": "4daeeb150f71a55b03769c9599bf54b72cc3cdf3a09691b62bfb3faea08b1a8b",
  "declaration_validation_errors": [],
  "demo_id": "ave-demo-001-binaural-construction",
  "demo_version": "1.0.0",
  "evidence_label": "verified",
  "forensics": {
    "analysis_configuration": {
      "carrier_detection": {
        "max_frequency_hz": 5000.0,
        "min_frequency_hz": 40.0,
        "selection": "strongest_per_channel_without_declared_target"
      },
      "configuration_schema_version": "demo-observation-0.2.0",
      "modulation_ramp": {
        "carrier_bandwidth_hz": 100.0,
        "envelope_sample_rate": 200,
        "hop_seconds": 0.5,
        "max_rate_hz": 40.0,
        "min_rate_hz": 1.0,
        "minimum_contiguous_coverage": 0.5,
        "minimum_coverage": 0.5,
        "minimum_fit_r_squared": 0.85,
        "minimum_peak_concentration": 0.12,
        "minimum_ramp_slope_hz_per_second": 0.05,
        "minimum_relative_variation": 0.01,
        "minimum_spectral_snr_db": 8.0,
        "window_seconds": 2.0
      },
      "pulse": {
        "envelope_sample_rate": 1000,
        "hard_state_separation": 0.72,
        "hop_seconds": 0.5,
        "max_rate_hz": 40.0,
        "maximum_interval_cv": 0.2,
        "min_rate_hz": 0.5,
        "minimum_low_state_fraction": 0.12,
        "minimum_pulse_count": 5,
        "minimum_relative_dynamic_range": 0.12,
        "window_seconds": 2.0
      },
      "request_version": "1.1.0",
      "requested_metrics": [
        "carrier_frequency_hz",
        "channel_routing_class",
        "duration_seconds",
        "interchannel_frequency_difference_hz",
        "sample_peak_linear"
      ]
    },
    "git": {
      "branch": "codex/generator-verification-handoff",
      "commit": "19acbfb4f9cf8d146aa5a22cefed36fbc294eae4",
      "dirty": false
    },
    "run_id": "ave_run_4b72f76fd9db0ae1",
    "source_tree_sha256": "8465a5ca52201c6f28790ffc5faf454b2cbac38e883eef0bf469ce61522a6462",
    "version": "0.5.0-dev"
  },
  "limitations": [
    "Agreement applies only to compared engineering fields.",
    "No evidence label establishes neurological entrainment, efficacy, therapeutic benefit, or exposure safety."
  ],
  "observation_sha256": "49158f2f3d9b731e0934a3ed83a6009798a4af16c0a0335592f4efec21462449",
  "ordering_attestation": {
    "declaration_loaded_during_detection": false,
    "targets_loaded_during_detection": false,
    "tolerances_loaded_during_detection": false
  }
}
