{
  "agreement_report_version": "0.1.0",
  "artifact_sha256": "e168b28756061651f13f67bdaf96ff7b0c943171d4d522e205010847951f9cfc",
  "claim_results": [
    {
      "claim_id": "light.duration",
      "confidence": 0.999756,
      "coverage_fraction": 0.999756,
      "errors": {
        "absolute_error": 0.0
      },
      "evidence_ids": [
        "ave_35180a5b8f1848c8",
        "ave_cff048bb4864a5c8"
      ],
      "limitations": [
        "Region boundaries are reconstructed from thresholded pixel timing signatures.",
        "Decoded frame timing describes the rendered file, not physical display refresh or optical output.",
        "Video pixels do not establish calibrated luminance, exposure safety, efficacy, or neurological response."
      ],
      "observed": {
        "kind": "scalar",
        "value": 4.0
      },
      "reason": "Numeric tolerance passed.",
      "required": true,
      "state": "agree"
    },
    {
      "claim_id": "light.region_count",
      "confidence": 0.999756,
      "coverage_fraction": 0.999756,
      "errors": {
        "absolute_error": 0.0
      },
      "evidence_ids": [
        "ave_cff048bb4864a5c8"
      ],
      "limitations": [
        "Region boundaries are reconstructed from thresholded pixel timing signatures.",
        "Decoded frame timing describes the rendered file, not physical display refresh or optical output.",
        "Video pixels do not establish calibrated luminance, exposure safety, efficacy, or neurological response."
      ],
      "observed": {
        "kind": "scalar",
        "value": 4
      },
      "reason": "Numeric tolerance passed.",
      "required": true,
      "state": "agree"
    },
    {
      "claim_id": "light.region_independence",
      "confidence": 0.999756,
      "coverage_fraction": 0.999756,
      "errors": {
        "exact_match": true
      },
      "evidence_ids": [
        "ave_cff048bb4864a5c8"
      ],
      "limitations": [
        "Region boundaries are reconstructed from thresholded pixel timing signatures.",
        "Decoded frame timing describes the rendered file, not physical display refresh or optical output.",
        "Video pixels do not establish calibrated luminance, exposure safety, efficacy, or neurological response."
      ],
      "observed": {
        "kind": "boolean",
        "value": true
      },
      "reason": "Exact comparison passed.",
      "required": true,
      "state": "agree"
    },
    {
      "claim_id": "light.explicit_off_intervals",
      "confidence": 0.999756,
      "coverage_fraction": 0.999756,
      "errors": {
        "exact_match": true
      },
      "evidence_ids": [
        "ave_cff048bb4864a5c8"
      ],
      "limitations": [
        "Region boundaries are reconstructed from thresholded pixel timing signatures.",
        "Decoded frame timing describes the rendered file, not physical display refresh or optical output.",
        "Video pixels do not establish calibrated luminance, exposure safety, efficacy, or neurological response."
      ],
      "observed": {
        "kind": "boolean",
        "value": true
      },
      "reason": "Exact comparison passed.",
      "required": true,
      "state": "agree"
    },
    {
      "claim_id": "video.refresh_rate",
      "confidence": 1.0,
      "coverage_fraction": 1.0,
      "errors": {
        "absolute_error": 0.0
      },
      "evidence_ids": [
        "ave_35180a5b8f1848c8"
      ],
      "limitations": [
        "Encoded cadence is not physical display refresh."
      ],
      "observed": {
        "kind": "scalar",
        "value": 60.0
      },
      "reason": "Numeric tolerance passed.",
      "required": true,
      "state": "agree"
    },
    {
      "claim_id": "video.frame_count",
      "confidence": 1.0,
      "coverage_fraction": 1.0,
      "errors": {
        "absolute_error": 0.0
      },
      "evidence_ids": [
        "ave_35180a5b8f1848c8"
      ],
      "limitations": [],
      "observed": {
        "kind": "scalar",
        "value": 240
      },
      "reason": "Numeric tolerance passed.",
      "required": true,
      "state": "agree"
    },
    {
      "claim_id": "light.recipe.identity",
      "confidence": null,
      "coverage_fraction": null,
      "errors": {},
      "evidence_ids": [],
      "limitations": [],
      "observed": null,
      "reason": "Generator recipe identity is not observable from rendered video pixels.",
      "required": true,
      "state": "not_evaluated"
    }
  ],
  "declaration_contract": "ave-demo-declaration@0.1.0",
  "declaration_id": "ave-demo-004-four-region-light@1.0.0",
  "declaration_schema_sha256": "aca39c90191762cde5048dfefc6f732d9e0c43e2da668194f2cc6cb04175ab45",
  "declaration_sha256": "571a0b5cfc27cb84870f7a37c6aec99c4dcd939ca0d5abc705833fbda9f5e11d",
  "declaration_validation_errors": [],
  "demo_id": "ave-demo-004-four-region-light",
  "demo_version": "1.0.0",
  "evidence_label": "partially_verified",
  "forensics": {
    "analysis_configuration": {
      "carrier_detection": {
        "max_frequency_hz": 5000.0,
        "min_frequency_hz": 40.0,
        "selection": "strongest_per_channel_without_declared_target"
      },
      "configuration_schema_version": "demo-observation-0.3.0",
      "modulation_ramp": {
        "carrier_bandwidth_hz": 100.0,
        "envelope_sample_rate": 200,
        "hop_seconds": 0.5,
        "max_rate_hz": 40.0,
        "min_rate_hz": 1.0,
        "minimum_contiguous_coverage": 0.5,
        "minimum_coverage": 0.5,
        "minimum_fit_r_squared": 0.85,
        "minimum_peak_concentration": 0.12,
        "minimum_ramp_slope_hz_per_second": 0.05,
        "minimum_relative_variation": 0.01,
        "minimum_spectral_snr_db": 8.0,
        "window_seconds": 2.0
      },
      "pulse": {
        "envelope_sample_rate": 1000,
        "hard_state_separation": 0.72,
        "hop_seconds": 0.5,
        "max_rate_hz": 40.0,
        "maximum_interval_cv": 0.2,
        "min_rate_hz": 0.5,
        "minimum_low_state_fraction": 0.12,
        "minimum_pulse_count": 5,
        "minimum_relative_dynamic_range": 0.12,
        "window_seconds": 2.0
      },
      "request_version": "1.1.0",
      "requested_metrics": [
        "duration_seconds",
        "explicit_off_intervals",
        "frame_count",
        "independent_region_schedules",
        "refresh_rate_hz",
        "region_count",
        "source_recipe_sha256"
      ],
      "video_regions": {
        "absolute_on_threshold": 0.02,
        "analysis_size": 64,
        "method": "connected_pixel_timing_signatures",
        "minimum_region_fraction": 0.02,
        "relative_on_threshold": 0.05
      }
    },
    "git": {
      "branch": "main",
      "commit": "ad1ddc537c6114dd332793ddd3272f477a6a9545",
      "dirty": false
    },
    "run_id": "ave_run_5555d8b6f10482cb",
    "source_tree_sha256": "a6fda7c2b9e72864264e88d09db4f4ca0b66f8ce0c788e31928a2cf88df2cd41",
    "version": "0.5.0-dev"
  },
  "limitations": [
    "Agreement applies only to compared engineering fields.",
    "No evidence label establishes neurological entrainment, efficacy, therapeutic benefit, or exposure safety."
  ],
  "observation_sha256": "0ae6d814d06bffb2ea1acc5acaed2a479e54ad0ef12c20091228e48ea1691434",
  "ordering_attestation": {
    "declaration_loaded_during_detection": false,
    "targets_loaded_during_detection": false,
    "tolerances_loaded_during_detection": false
  }
}
